<?xml version="1.0" encoding="UTF-8" ?>
<vocabulary
  xmlns:xsi="http://www.w3.org/2001/XMLSchema-instance"
  xsi:noNamespaceSchemaLocation="../../schema/vocab_schema.xsd"
>
    <unit
      name_en="Hidden N5 words"
      hasRomaji="true"
      hasFurigana="true"
      lvl="n5"
      HIDDEN="true"
      ignoresCombinedReadings="false"
    >
        <section>
            <word
              w="【山：やま】【田：だ】"
              rom="Yamada"
              tr_en="Mr Yamada"
              lvl="n5"
              HIDDEN="true"
              rem="just to provide the reading for the furigana check of sentences"
            />
            <word
              w="【小：こ】【林：ばやし】"
              rom="Kobayashi"
              tr_en="Mr Kobayashi"
              lvl="n5"
              HIDDEN="true"
              rem="just to provide the reading for the furigana check of sentences"
            />
            <word
              w="【高：たか】【木：ぎ】"
              rom="Takagi"
              tr_en="Mr Takagi"
              lvl="n5"
              HIDDEN="true"
              rem="just to provide the reading for the furigana check of sentences"
            />

            <!-- expression -->
            <word
              w="【木：こ】の 【葉：は】"
              rom="ko no ha"
              tr_en="leaves of a tree"
              lvl="n5"
              HIDDEN="true"
              rem="just to provide the reading; jisho has nx for このは"
              href="https://hinative.com/questions/22085422"
            />

            <!-- pronouns and particles -->
            <word
              w="こんな"
              rom="konna"
              tr_en="this sort of; such"
              lvl="n5"
            />
            <word
              w="こんなに"
              rom="konna ni"
              tr_en="so; like this; in this way"
              hint_en="adverb"
              lvl="n5"
              rem="jisho has n3"
            />
            <word
              w="こちら"
              rom="kochira"
              tr_en="this way; this direction"
              lvl="n5"
            />
            <word
              w="あそこ"
              rom="asoko"
              tr_en="there; over there"
              lvl="n5"
            />
            <word
              w="あちら"
              rom="achira"
              tr_en="that way; over there; yonder"
              hint_en="far from both speaker and listener"
              hint_de="weit weg"
              lvl="n5"
              rem="appears in GENKI2 L20 vocab section with the remark 'polite'; is this really n5?"
            />
            <word
              w="はい"
              rom="hai"
              tr_en="yes"
              lvl="n5"
            />
            <word
              w="ええ"
              rom="ee"
              tr_en="yes; that is correct; huh?"
              lvl="n5"
            />
            <word
              w="いいえ"
              rom="iie"
              tr_en="no"
              lvl="n5"
            />

            <!-- adjective -->
            <word
              w="【大：おお】きな"
              rom="ōki na"
              tr_en="big; large; great"
              hint_en="adj."
              lvl="n5"
            />
            <word
              w="【小：ちい】さな"
              rom="chīsa na"
              tr_en="small; little; tiny"
              hint_en="adj."
              lvl="n5"
            />

            <!-- adverb -->
            <word
              w="どうも"
              rom="dōmo"
              tr_en="thanks; very (sorry); hello; goodbye"
              hint_en="adverb"
              lvl="n5"
            />
            <word
              w="【一：いっ】【緒：しょ】"
              rom="issho"
              tr_en="together; at the same time"
              hint_en="adverb; noun"
              lvl="n5"
            />

            <!-- verb -->
            <word
              w="【来：こ】ない"
              rom="konai"
              tr_en="I don't come"
              lvl="n5"
              HIDDEN="true"
              rem="just to provide the reading for the furigana check of sentences"
            />

            <!-- prefix, suffix -->
            <word
              w="【来：らい】"
              rom="rai"
              tr_en="next (year, spring, etc.); coming"
              hint_en="prefix; suffix"
              lvl="n5"
              id="rai-next"
              HIDDEN="true"
              rem="not a good word; jisho has n3"
            />

            <!-- unsorted -->
            <word
              w="【有：あ】り【難：がと】う"
              rom="arigatou"
              tr_en="thank you; thanks"
              usuallyInKana="true"
              lvl="n5"
              id="arigatou-thanks"
              rem="jisho has n3"
            >
                <keep_apart_from id="okage-grace" />
                <keep_apart_from id="kansha-thanks" />
                <keep_apart_from id="arigatou-thxalt" />
                <keep_together id="arigatou-thxalt" />
            </word>
            <word
              w="【有：あり】【難：がと】う"
              rom="arigatou"
              tr_en="thank you; thanks"
              usuallyInKana="true"
              lvl="n5"
              id="arigatou-thxalt"
              rem="jisho has n3"
            >
                <keep_apart_from id="arigatou-thanks" />
                <keep_together id="arigatou-thanks" />
            </word>
            <word
              w="【頂：いただ】きます"
              rom="itadakimasu"
              tr_en="thank you (for the meal just served); I receive (this meal)"
              hint_en="expressions (phrases, clauses, etc.)"
              lvl="n5"
              usuallyInKana="true"
              rem="jisho has n3"
            />
            <word
              w="もう【一：いち】【度：ど】"
              rom="mō ichi-do"
              tr_en="once more; again"
              hint_en="expressions (phrases, clauses, etc.)"
              lvl="n5"
              HIDDEN="true"
              rem="is a phrase in counters_3"
            />
            <word
              w="【御：ご】【免：めん】なさい"
              rom="gomen nasai"
              tr_en="I'm sorry; my apologies; excuse me; pardon me"
              hint_en="expressions (phrases, clauses, etc.)"
              lvl="n5"
              rem="jisho has n3"
              usuallyInKana="true"
            />
            <word
              w="【如何：どう】して"
              rom="dō shite"
              tr_en="how; in what way; by what means; why"
              hint_en="adverb (fukushi)"
              hasCombinedReading="true"
              lvl="n5"
            />
            <word
              w="あの"
              rom="ano"
              tr_en="say; well; um; er"
              lvl="n5"
            />
            <word
              w="その"
              rom="sono"
              tr_en="that; the"
              lvl="n5"
              id="sono-that"
            />
            <word
              w="この"
              rom="kono"
              tr_en="this"
              lvl="n5"
              id="kono-this"
              HIDDEN="true"
              rem="must not be together with kore"
            />
            <word
              w="さあ"
              rom="sā"
              tr_en="come; come now; well; let's see"
              hint_en="conjunction"
              lvl="n5"
            />
            <word
              w="じゃあ"
              rom="jā"
              tr_en="then; well; so"
              hint_en="conjunction"
              lvl="n5"
            />
            <word
              w="では"
              rom="de wa"
              tr_en="then; well then; if not ..."
              hint_en="conjunction"
              lvl="n5"
            />
            <word
              w="より"
              rom="yori"
              tr_en="than; out of; except"
              hint_en="particle"
              lvl="n5"
            />
            <word
              w="そうして"
              rom="sō shite"
              tr_en="and; like that"
              hint_en="conjunction"
              lvl="n5"
            />
            <word
              w="そして"
              rom="soshite"
              tr_en="and then; thus"
              hint_en="conjunction"
              lvl="n5"
            />
            <word
              w="【一：ひと】【月：つき】"
              rom="hito-tsuki"
              tr_en="one month"
              hint_en="noun"
              lvl="n5"
            />
            <word
              w="どうぞ"
              rom="dōzo"
              tr_en="please; kindly; by all means"
              hint_en="adverb"
              lvl="n5"
            />
            <word
              w="【日：にち】"
              rom="nichi"
              tr_en="day (of the month); Sunday; counter for days"
              tr_de="Tag (des Monats); Sonntag; Zähler für Tage"
              lvl="n5"
              id="nichi-day"
              HIDDEN="true"
              rem="kind of wrong, because 日 by itself is usually pronounced hi; jisho has n3"
            />
            <word
              w="【今：こん】【日：にち】は"
              rom="konnichi wa"
              tr_en="hello; good day; good afternoon"
              lvl="n5"
              usuallyInKana="true"
              HIDDEN="true"
              rem="this is a phrase; jisho has n3"
            />
        </section>
    </unit>
</vocabulary>
