<?xml version="1.0" encoding="UTF-8" ?>
<vocabulary
  xmlns:xsi="http://www.w3.org/2001/XMLSchema-instance"
  xsi:noNamespaceSchemaLocation="../../schema/vocab_schema.xsd"
>
    <unit
      name_en="Hidden N3 verbs"
      hasRomaji="true"
      hasFurigana="true"
      defaultHint_en="verb"
      defaultHint_de="Verb"
      lvl="n3"
      requiresSentences="false"
      requiresPhrases="false"
      HIDDEN="true"
    >
        <section>
            <!-- unsorted -->
            <word
              w="【収：おさ】める"
              rom="osameru"
              tr_en="to pay (fees); to bring to a close; to achieve (a result)"
              tr_de="(Gebühren) zahlen; beenden; (ein Resultat) erreichen"
              lvl="n3"
              category="work, finances"
              id="osameru-pay"
            >
                <keep_apart_from id="eru-earn" />
                <keep_apart_from id="shōjiru-yield" />
                <phrase
                  ph="【成：せい】【功：こう】を【収：おさ】める"
                  rom="seikō o osameru"
                  tr_en="to come out successful; to achieve success"
                  tr_de="erfolgreich sein; Erfolg haben"
                  lvl="n3"
                  origin="lib0"
                />
            </word>
            <word
              w="【扱：あつか】う"
              rom="atsukau"
              tr_en="to deal with (a person, problem); to operate (a machine)"
              tr_de="sich (einem Problem, einer Person) annehmen; (Maschine) bedienen"
              lvl="n3"
              category="work, technical"
              id="atsukau-dealwith"
            />
            <word
              w="【得：う】る"
              rom="uru"
              tr_en="to be able to; to acquire sth.; to gain"
              tr_de="etw. können; sich etw. aneignen; etw. gewinnen"
              hint_en="v.t."
              lvl="n3"
              category="work"
              id="uru-obtain"
            />
            <word
              w="【防：ふせ】ぐ"
              rom="fusegu"
              tr_en="to defend against; to protect against; to avert"
              tr_de="sich gegen etw. verteidigen; sich gegen etw. schützen; etw. abwenden"
              hint_en="v.t."
              lvl="n3"
              category="general, politics"
              id="fusegu-avert"
            />
            <word
              w="【解：と】ける"
              rom="tokeru"
              tr_en="to be solved; to come undone; (spell) to be broken"
              tr_de="gelöst sein; lose werden; (Bann) aufgehoben sein"
              hint_en="v.i."
              lvl="n3"
              category="general"
              id="tokeru-besolved"
            />
            <word
              w="【支：ささ】える"
              rom="sasaeru"
              tr_en="to support; to defend; to hold at bay"
              tr_de="etw. unterstützen; etw. verteidigen; etw. in Schach halten"
              hint_en="v.t."
              lvl="n3"
              category="general, politics"
              id="sasaeru-support"
            />
            <word
              w="【欠：か】ける"
              rom="kakeru"
              tr_en="to be damaged; to be lacking; to be missing"
              tr_de="beschädigt sein; fehlen"
              lvl="n3"
              category="not-good, technical"
              id="kakeru-damaged"
            />
            <word
              w="【遣：や】る"
              rom="yaru"
              tr_en="to give sth."
              tr_de="etw. geben"
              hint_en="to pets, plants, younger siblings, etc."
              hint_de="einem Tier, einer Pflanze, einem jüngeren Geschwister, usw."
              studyInContext="required"
              lvl="n3"
              category="animal, hands"
              id="yaru-give"
              usuallyInKana="true"
              HIDDEN="true"
            >
                <!-- implicit see-also link to yaru-undertake -->
            </word>
            <word
              w="【眺：なが】める"
              rom="nagameru"
              tr_en="to gaze at; to admire (the scenery); to contemplate (a painting)"
              tr_de="betrachten; (Landschaft) bewundern; (einem Gemälde) nachsinnen"
              hint_en="v.t."
              lvl="n3"
              category="looking"
              id="nagameru-gaze"
            />
            <word
              w="【受：う】かる"
              rom="ukaru"
              tr_en="to pass (examination)"
              hint_en="v.i."
              lvl="n3"
              id="ukaru-pass"
              rem="jisho has n1"
            >
                <see id="ukeru-receive" type="v.t." />
                <keep_apart_from id="gōkaku-passexam" />
            </word>
            <word
              w="【取：と】り【調：しら】べる"
              rom="tori-shiraberu"
              tr_en="to investigate; to examine"
              hint_en="v.t."
              lvl="n3"
              rem="jisho has n1"
              id="torishiraberu-investigate"
            >
                <keep_apart_from id="shiraberu-lookup" />
            </word>
            <word
              w="【預：あず】ける"
              rom="azukeru"
              tr_en="to put sth. in so.'s care; to leave sth. in so.'s keeping"
              tr_de="etw. jemandem anvertrauen"
              hint_en="v.t."
              lvl="n3"
              category="general, relationships"
              id="azukeru-putincare"
            >
                <see id="azukaru-keepincustody" type="closely related" />
                <keep_apart_from id="sewa-trouble" />
            </word>
            <word
              w="【及：およ】ぼす"
              rom="oyobosu"
              tr_en="to exert (influence); to cause (damage); to bring about (benefits)"
              tr_de="(Einfluss) ausüben; (Schaden) anrichten; (Nutzen) bringen"
              lvl="n3"
              category="general"
              id="oyobosu-cause"
            />
            <word
              w="【燃：も】える"
              rom="moeru"
              tr_en="to burn; to get fired up"
              hint_en="v.i."
              lvl="n3"
              id="moeru-burn"
            />
            <word
              w="【罰：ばっ】する"
              rom="bassuru"
              tr_en="to punish; to penalize; to penalise"
              hint_en="suru verb"
              lvl="n3"
              id="bassuru-punish"
            />
            <word
              w="【異：こと】なる"
              rom="kotonaru"
              tr_en="to differ; to be different; to diverge"
              hint_en="v.i."
              lvl="n3"
              id="kotonaru-differ"
            />
            <word
              w="【引：ひ】っ【張：ぱ】る"
              rom="hipparu"
              tr_en="to pull tight; to string (lines); to run (cable); to put on"
              hint_en="v.t."
              lvl="n3"
              id="hipparu-run"
            />
            <word
              w="【戦：たたか】う"
              rom="tatakau"
              tr_en="to wage war; to fight (with); to compete (against)"
              hint_en="v.i."
              lvl="n3"
              id="tatakau-fight"
            />
            <word
              w="【対：たい】する"
              rom="tai suru"
              tr_en="to face; to be facing; to be related to"
              hint_en="suru verb (special class)"
              lvl="n3"
              id="taisuru-face"
            />
            <word
              w="【達：たっ】する"
              rom="tassuru"
              id="tassuru-reach"
              tr_en="to reach; to get to; to arrive at"
              hint_en="suru verb (special class)"
              lvl="n3"
            />
            <word
              w="【断：ことわ】る"
              rom="kotowaru"
              tr_en="to refuse; to reject; to dismiss; to turn down; to decline / to inform; to give notice; to tell in advance / to ask leave; to excuse oneself (from)"
              hint_en="v.t."
              lvl="n3"
            >
                <!--
                お願いを断る - to turn down, reject a wish (ChatGPT)
                -->
            </word>
            <word
              w="【含：ふく】む"
              rom="fukumu"
              tr_en="to contain; to comprise; to have; to hold; to include; to embrace / to hold in the mouth / to bear in mind; to understand; to harbor (grudge, etc.); to harbour / to express (emotion, etc.); to imply"
              hint_en="v.t."
              lvl="n3"
            />
            <word
              w="【就：つ】く"
              rom="tsuku"
              tr_en="to take (seat, position, course, office, etc.); to assume; to be hired; to be employed / to ascend (the throne); to accede / to start (on a journey); to commence; to depart / to study (under teacher); to be an apprentice"
              hint_en="v.i."
              lvl="n3"
              id="tsuku-assume"
            />
            <word
              w="【積：つ】もる"
              rom="tsumoru"
              tr_en="to pile up; to accumulate / to estimate"
              hint_en="v.t. &amp; i."
              lvl="n3"
            />
            <word
              w="【雇：やと】う"
              rom="yatou"
              tr_en="to employ; to hire; to take on / to charter (a car, boat, etc.); to hire"
              hint_en="v.t."
              lvl="n3"
            />
        </section>
    </unit>
</vocabulary>
