<?xml version="1.0" encoding="UTF-8" ?>
<vocabulary
  xmlns:xsi="http://www.w3.org/2001/XMLSchema-instance"
  xsi:noNamespaceSchemaLocation="../../schema/vocab_schema.xsd"
>
    <unit
      name_en="Hidden N1 Counters"
      name_de="N1 Zählwörter"
      name_fr="Les mots de compter N1"
      name_it="Parole da contare N1"
      hasRomaji="true"
      hasFurigana="true"
      lvl="n1"
      ignoresCombinedReadings="false"
      HIDDEN="true"
    >
        <section>
            <word
              w="【問：もん】"
              rom="mon"
              tr_en="counter for questions"
              tr_de="Zählwort für Fragen"
              lvl="n1"
              id="mon-questions"
            />

            <!-- HIDDEN -->
            <word
              w="【版：はん】"
              rom="han"
              tr_en="edition; version; printing; impression; implementation (e.g. software); editions of a publication"
              lvl="n1"
              id="han-edition"
              HIDDEN="true"
            />
            <word
              w="【等：とう】"
              rom="tō"
              tr_en="class; order; rank; et cetera; etc.; and the like; equal; iso-"
              lvl="n1"
              id="tō-rank"
              HIDDEN="true"
            />
            <word
              w="【膳：ぜん】"
              rom="zen"
              tr_en="small dining table; serving tray; serving; counter for bowlfuls of rice; counter for pairs of chopsticks"
              lvl="n1"
              id="zen-tray"
              HIDDEN="true"
            />
            <word
              w="【畳：じょう】"
              rom="jō"
              tr_en="tatami mat (esp. as a measure of room size, either 1.82 sqm or 1.54 sqm)"
              lvl="n1"
              id="jō-tatamimat"
              HIDDEN="true"
            />
            <word
              w="【振：ふ】り"
              rom="furi"
              tr_en="shake; wave; swinging; appearance; behaviour; pretense; counter for swords, blades, etc."
              lvl="n1"
              id="furi-swing"
              HIDDEN="true"
            />
            <word
              w="【柱：はしら】"
              rom="hashira"
              tr_en="pillar; post; support; prop; mainstay; counter for buddhas, gods, nobles"
              lvl="n1"
              id="hashira-buddhas"
              HIDDEN="true"
            />
            <!-- rōmaji not unique...
              w="【戸：こ】"
              rom="ko"
              tr_en="counter for houses, households, apartments, etc."
              lvl="n1"
              id="ko-houses"
              HIDDEN="true"
            -->
            <word
              w="【校：こう】"
              rom="kō"
              tr_en="school; proof (of a book, document, etc.); counter for proofs"
              lvl="n1"
              id="kō-proofs"
              HIDDEN="true"
            />
            <word
              w="【次：じ】"
              rom="ji"
              tr_en="next; hypo- (i.e. containing an element with low valence); order; sequence; time; times"
              lvl="n1"
              id="ji-next"
              HIDDEN="true"
            />
            <word
              w="【泊：はく】"
              rom="haku"
              tr_en="counter for nights of a stay; overnight stay; lodging"
              lvl="n1"
              id="haku-nights"
              HIDDEN="true"
            />
            <!-- section
              name_en="ヶ月: Month-long periods"
              name_de="ヶ月: Monate-lange Intervalle"
            -->
            <!--
                ヶ月 is n1
                いっかげつ
                ろっかげつ
                はっかげつ
                じゅっかげつ
                なんかげつ？
            -->
            <!-- /section -->
            <!-- section
              name_en="階: Floors, storeys"
              name_de="階: Stockwerke"
            -->
            <!-- jisho: 階 is N1, 階段 is N5, 二階建て is N4, nan-kai is nx -->
            <!--
                いっかい
                さんがい
                ろっかい
                はっかい
                じゅっかい
                なんがい？
            -->
            <!-- /section -->
        </section>
    </unit>
</vocabulary>
