<?xml version="1.0" encoding="UTF-8" ?>
<vocabulary
  xmlns:xsi="http://www.w3.org/2001/XMLSchema-instance"
  xsi:noNamespaceSchemaLocation="../../schema/vocab_schema.xsd"
>
    <unit
      name_en="N2 verbs ③"
      name_de="N2-Verben ③"
      name_fr="Les verbes N2 ③"
      name_it="Verbi N2 ③"
      hasRomaji="true"
      hasFurigana="true"
      defaultHint_en="verb"
      defaultHint_de="Verb"
      lvl="n2"
      requiresSentences="false"
      requiresPhrases="false"
    >
        <section>
            <!-- unsorted -->
            <word
              w="【張：は】り【切：き】る"
              rom="hari-kiru"
              tr_en="to be enthusiastic; to be in high spirits"
              tr_de="enthusiastisch sein; in gehobener Stimmung sein"
              Langenscheidt="-"
              lvl="n2"
              id="harikiru-highspirits"
              rem="appears in 500mon N3 q38 (no example); appears in Doraemon 17, p.152"
            >
                <keep_apart_from id="isshōkenmei-utmosteffort" />
                <keep_apart_from id="omoikiri-withallstrength" />
                <!--
                    Can it mean to stretch to breaking point / bis zum Äussersten strapazieren ?
                -->
                <sentence
                  s="はりきって【歌：うた】うぞ！"
                  rom="Hari-kitte utau zo!"
                  tr_en="I'm going to sing my heart out!"
                  tr_de="Ich werden mit ganzem Elan singen!"
                  lvl="n2"
                  origin="Doraemon 17, p.152"
                >
                    <ask w="はりきって" />
                </sentence>
            </word>
            <word
              w="【解：ほど】く"
              rom="hodoku"
              tr_en="to undo; to untie; to unfasten"
              tr_de="lösen; aufbinden; entwirren"
              hint_en="v.t."
              lvl="n2"
              id="hodoku-undo"
            />
            <word
              w="【心：こころ】【得：え】る"
              rom="kokoroeru"
              tr_en="to know; to understand; to be aware of"
              tr_de="wissen; verstehen; sich etw. bewusst sein"
              hint_en="v.t."
              lvl="n2"
              id="kokoroeru-know"
            />
            <word
              w="【診：み】る"
              rom="miru"
              tr_en="to examine (medically)"
              tr_de="(medizinisch) untersuchen"
              hint_en="v.t."
              lvl="n2"
              category="health, looking"
              id="miru-examine"
            />
            <word
              w="【引：ひ】っ【込：こ】む"
              rom="hikkomu"
              tr_en="to draw back; to retire to (somewhere); to stay indoors"
              tr_de="sich zurückziehen; drinnen bleiben"
              hint_en="v.i."
              lvl="n2"
              id="hikkomu-drawback"
            />
            <word
              w="【受：う】け【持：も】つ"
              rom="ukemotsu"
              tr_en="to take charge of; to be in charge of"
              tr_de="sich um etw. kümmern; für etw. zuständig sein"
              hint_en="v.t."
              lvl="n2"
              id="ukemotsu-takechargeof"
            />
            <word
              w="【憧：あこが】れる"
              rom="akogareru"
              tr_en="to long for; to yearn after; to be attracted by"
              tr_de="sich nach etw. sehnen; nach etw. verlangen; von etw. angezogen sein"
              hint_en="v.i."
              lvl="n2"
              id="akogareru-longfor"
            />
            <word
              w="【転：ころ】がす"
              rom="korogasu"
              tr_en="to roll; to tip over"
              tr_de="etw. rollen lassen; etw. umkippen"
              hint_en="v.t."
              lvl="n2"
              id="korogasu-roll"
            />
            <word
              w="【溢：あふ】れる"
              rom="afureru"
              tr_en="to overflow; to brim over; to flood"
              tr_de="überschwappen; übervoll werden; überschwemmt werden"
              hint_en="v.i."
              lvl="n2"
              id="afureru-overflow"
            />
            <word
              w="【巫：ふ】【山：ざ】【戯：け】る"
              rom="fuzakeru"
              tr_en="to joke; to make fun of; to laugh at"
              tr_de="witzeln; sich über etw. oder jem. lustig machen"
              usuallyInKana="true"
              lvl="n2"
              id="fuzakeru-joke"
            />
            <word
              w="【囁：ささや】く"
              rom="sasayaku"
              tr_en="to whisper"
              tr_de="flüstern"
              lvl="n2"
              usuallyInKana="true"
              category="talking"
              id="sasayaku-whisper"
            />
            <word
              w="【思：おも】い【込：こ】む"
              rom="omoikomu"
              tr_en="to assume; to be determined (to do); to think obsessively (about)"
              tr_de="annehmen; entschieden sein (etw. zu tun)"
              hint_en="v.i."
              lvl="n2"
              id="omoikomu-assume"
            />
            <word
              w="【透：す】き【通：とお】る"
              rom="sukitōru"
              tr_en="to be transparent; to be clear"
              tr_de="transparent sein; klar sein"
              hint_en="v.i."
              lvl="n2"
              id="sukitōru-transparent"
            />
            <word
              w="【目：め】【立：だ】つ"
              rom="medatsu"
              tr_en="to be conspicuous; to stand out"
              tr_de="auffällig sein; auffallen"
              hint_en="v.i."
              lvl="n2"
              id="medatsu-standout"
            />
            <word
              w="【掘：ほ】る"
              rom="horu"
              tr_en="to dig; to excavate"
              tr_de="graben; ausgraben"
              lvl="n2"
              category="diy, garden"
              id="horu-todig"
            />
            <word
              w="【越：こ】える"
              rom="koeru"
              tr_en="to cross over; to pass through; to go past"
              tr_de="überqueren; durchkommen; hindurch gehen"
              hint_en="v.t."
              lvl="n2"
              id="koeru-crossover"
            >
                <keep_apart_from id="hei-fence" rem="ambiguity in phrases" />
            </word>
            <word
              w="【砕：くだ】ける"
              rom="kudakeru"
              tr_en="to break (into pieces); to be broken; to crumble"
              tr_de="(in Stücke) zerbrechen; bersten; kaputt sein"
              hint_en="v.i."
              lvl="n2"
              id="kudakeru-break"
            />
            <word
              w="しゃがむ"
              rom="shagamu"
              tr_en="to squat; to crouch"
              tr_de="kauern; hocken"
              hint_en="v.i."
              lvl="n2"
              id="shagamu-squat"
            />
            <word
              w="【草臥：くたび】れる"
              rom="kutabireru"
              tr_en="to be exhausted"
              tr_de="erschöpft sein"
              hasCombinedReading="true"
              lvl="n2"
              category="mood"
              id="kutabireru-exhausted"
              rem="appears in Doraemon 13, p.184 (not usable as example)"
            />
            <word
              w="【生：な】る"
              rom="naru"
              tr_en="to bear fruit"
              tr_de="Früchte tragen"
              hint_en="v.i."
              lvl="n2"
              id="naru-bearfruit"
            />
            <word
              w="【削：けず】る"
              rom="kezuru"
              tr_en="to shave (wood); to sharpen (pencil); to cut down (budget)"
              tr_de="(Holz) hobeln; (Bleistift) spitzen; (Budget) kürzen"
              hint_en="v.t."
              lvl="n2"
              id="kezuru-shave"
            />
            <word
              w="【言：こと】【付：づ】ける"
              rom="kotodzukeru"
              tr_en="to have someone send sth.; to use as an excuse"
              tr_de="etw. via jem. anderen schicken lassen; etw. als Ausrede verwenden"
              hint_en="v.t."
              lvl="n2"
              id="kotodzukeru-havesbsend"
            />
            <word
              w="【呆：あき】れる"
              rom="akireru"
              tr_en="to be amazed; to be shocked; to be disgusted"
              tr_de="erstaunt sein; schockiert sein; angewidert sein"
              lvl="n2"
              category="mood"
              id="akireru-amazed"
            />
            <word
              w="【擦：こす】る"
              rom="kosuru"
              tr_en="to rub; to scrub; to scrape"
              tr_de="reiben; schrubben; schaben"
              hint_en="v.t."
              lvl="n2"
              usuallyInKana="true"
              id="kosuru-rub"
            />
            <word
              w="【存：ぞん】じる"
              rom="zonjiru"
              tr_en="to think; to feel; to consider"
              tr_de="denken; fühlen; in Betracht ziehen"
              lvl="n2"
              rem="appears in 500mon q393; but as a polite form of shiru..."
              id="zonjiru-think"
            />
        </section>
    </unit>
</vocabulary>
