<?xml version="1.0" encoding="UTF-8" ?>
<vocabulary
  xmlns:xsi="http://www.w3.org/2001/XMLSchema-instance"
  xsi:noNamespaceSchemaLocation="../../schema/vocab_schema.xsd"
>
    <unit
      name_en="Chinese zodiac"
      name_de="Chinesischer Tierkreis"
      name_fr="Le zodiaque chinois"
      name_it="Lo zodiaco cinese"
      lvl="-"
      hasRomaji="true"
      hasFurigana="true"
      requiresSentences="false"
      requiresPhrases="false"
    >
        <section>
            <word
              w="【子：ね】"
              rom="ne"
              tr_en="The Rat (zodiac)"
              tr_de="Ratte (Tierzeichen)"
              lvl="-"
              id="ne-rat"
            >
                <see id="nezumi-mouse" type="closely related" />
            </word>
            <word
              w="【丑：うし】"
              rom="ushi"
              tr_en="The Ox (zodiac)"
              tr_de="Büffel (Tierzeichen)"
              lvl="-"
              id="ushi-zodiac"
            >
                <see id="ushi-cow" type="closely related" />
            </word>
            <word
              w="【寅：とら】"
              rom="tora"
              tr_en="The Tiger (zodiac)"
              tr_de="Tiger (Tierzeichen)"
              lvl="-"
              id="tora-zodiac"
            >
                <see id="tora-tiger" type="closely related" />
            </word>
            <word
              w="【卯：う】"
              rom="u"
              tr_en="The Hare (zodiac)"
              tr_de="Hase (Tierzeichen)"
              lvl="-"
              id="u-hare"
            >
                <see id="usagi-rabbit" type="closely related" />
            </word>
            <word
              w="【辰：たつ】"
              rom="tatsu"
              tr_en="The Dragon (zodiac)"
              tr_de="Drache (Tierzeichen)"
              lvl="-"
              id="tatsu-zodiac"
            >
                <see id="ryū-dragon" type="closely related" />
            </word>
            <word
              w="【巳：み】"
              rom="mi"
              tr_en="The Serpent (zodiac)"
              tr_de="Schlange (Tierzeichen)"
              lvl="-"
              id="mi-zodiac"
            >
                <see id="hebi-snake" type="closely related" />
            </word>
            <word
              w="【午：うま】"
              rom="uma"
              tr_en="The Horse (zodiac)"
              tr_de="Pferd (Tierzeichen)"
              lvl="-"
              id="uma-zodiac"
            >
                <see id="uma-horse" type="closely related" />
            </word>
            <word
              w="【未：ひつじ】"
              rom="hitsuji"
              tr_en="The Ram (zodiac)"
              tr_de="Schaf (Tierzeichen)"
              lvl="-"
              id="hitsuji-zodiac"
            >
                <see id="hitsuji-sheep" type="closely related" />
            </word>
            <word
              w="【申：さる】"
              rom="saru"
              tr_en="The Monkey (zodiac)"
              tr_de="Affe (Tierzeichen)"
              lvl="-"
              id="saru-zodiac"
            >
                <see id="saru-monkey" type="closely related" />
            </word>
            <word
              w="【酉：とり】"
              rom="tori"
              tr_en="The Bird (zodiac)"
              tr_de="Hahn (Tierzeichen)"
              lvl="-"
              id="tori-zodiac"
            >
                <see id="tori-bird" type="closely related" />
            </word>
            <word
              w="【戌：いぬ】"
              rom="inu"
              tr_en="The Dog (zodiac)"
              tr_de="Hund (Tierzeichen)"
              lvl="-"
              id="inu-zodiac"
            >
                <see id="inu-dog" type="closely related" />
            </word>
            <word
              w="【亥：い】"
              rom="i"
              tr_en="The Boar (zodiac)"
              tr_de="Schwein (Tierzeichen)"
              lvl="-"
              id="i-boar"
            >
                <see id="buta-pig" type="closely related" />
            </word>
        </section>
    </unit>
</vocabulary>
